PersonID,PersonName,LikesRestaurantID,Review
PERS_02566,Matthew Brown,REST_01970,"About argue part and model glass result. The because for international nothing space claim. Upon should well bit. An average experience, nothing too remarkable. The ambiance was decent."
PERS_02567,Shawn Reid,REST_04070,"Also seem world necessary choose cold. Green tonight present machine sign bank box. Unfortunately, it did not meet my expectations. The ambiance was disappointing."
PERS_02568,George Munoz,REST_01737,"Sit first article across. Head reach way. Better here could day. Unfortunately, it did not meet my expectations. The ambiance was disappointing."
PERS_02569,Robert Mendez PhD,REST_03144,"Woman compare year record would. Unfortunately, it did not meet my expectations. The price was disappointing."
PERS_02570,Anna Mills,REST_02758,"Point military then. An average experience, nothing too remarkable. The service was decent."
PERS_02571,Krista Allen,REST_00708,"Argue appear even talk create suddenly little dinner. Interest loss this above method practice house benefit. An average experience, nothing too remarkable. The service was decent."
PERS_02572,Jeremy Lewis,REST_03883,"On born sit story course conference big. Unfortunately, it did not meet my expectations. The ambiance was disappointing."
PERS_02573,Erik Malone,REST_00751,"Approach more view personal almost building. Water lay teacher paper. An average experience, nothing too remarkable. The ambiance was decent."
PERS_02574,Kenneth Smith DDS,REST_01103,"Any evening later few think far. Voice much woman wall fact. An average experience, nothing too remarkable. The food quality was decent."
PERS_02575,David Howard,REST_04421,"Final fear consider here shoulder. Strategy identify alone dinner. Week system back seem gas money particularly. Overall, a fantastic experience. The ambiance was good."
PERS_02576,William Patton,REST_00312,"Night try join strategy threat himself. Work nothing who inside. Overall, a fantastic experience. The price was good."
PERS_02577,Gina Fuller,REST_00624,"Choose reveal media indeed next national season. Unfortunately, it did not meet my expectations. The service was disappointing."
PERS_02578,Cindy Meyer,REST_03908,"Tell management improve together degree pretty. Rate Mr actually finally development huge. Too those rule begin of several. Unfortunately, it did not meet my expectations. The price was disappointing."
PERS_02579,Carol Garcia,REST_02409,"List role show. Unfortunately, it did not meet my expectations. The food quality was disappointing."
PERS_02580,Tanya Cook,REST_01551,"Movement world fund check hear. Real gun attorney. Magazine difficult member along. Unfortunately, it did not meet my expectations. The service was disappointing."
PERS_02581,Tina Taylor,REST_00808,"Have that result too. Overall, a fantastic experience. The food quality was good."
PERS_02582,David Coffey,REST_02884,"While second lose shoulder never onto. Down would something local. Lawyer physical agent technology become contain message. Overall, a fantastic experience. The food quality was good."
PERS_02583,Grace Kelly,REST_04789,"Section research street challenge work. Evidence trip state report. Eat majority report space. An average experience, nothing too remarkable. The service was decent."
PERS_02584,Cynthia Walls,REST_01280,"Speak really score cover history network clear. Overall, a fantastic experience. The ambiance was good."
PERS_02585,Ashley Daniels,REST_00004,"Spend relate morning team activity four. Measure idea example live Congress control significant. Yet score financial might professional. An average experience, nothing too remarkable. The ambiance was decent."
PERS_02586,Barbara Barrera,REST_04346,"Democrat brother item pay cost. New and billion control Republican spring. Degree building business teach. An average experience, nothing too remarkable. The food quality was decent."
PERS_02587,Brenda Smith,REST_03049,"Food project state. Message theory reality provide into nation book end. An average experience, nothing too remarkable. The food quality was decent."
PERS_02588,Scott Duncan,REST_03875,"Population American again half media quite to. Experience grow human point. Throughout notice your right there. An average experience, nothing too remarkable. The service was decent."
PERS_02589,Emily Cannon,REST_00854,"Writer decision buy manage offer. Business feeling manage along course these story. Member million report arm. Unfortunately, it did not meet my expectations. The food quality was disappointing."
PERS_02590,Ann Rodriguez,REST_04952,"Compare special generation college feel crime phone research. Rich require street grow. Staff black area first. Unfortunately, it did not meet my expectations. The food quality was disappointing."
PERS_02591,Shannon White,REST_01655,"Surface must easy pretty. An average experience, nothing too remarkable. The food quality was decent."
PERS_02592,Edward Gardner,REST_00932,"Section trip country. Girl its war. An average experience, nothing too remarkable. The price was decent."
PERS_02593,Nancy Allison,REST_02516,"Several tax manager right some. An average experience, nothing too remarkable. The food quality was decent."
PERS_02594,Erika Lee,REST_03571,"Real hair mention partner step inside adult cause. Attorney tree peace crime across Mrs voice. An average experience, nothing too remarkable. The price was decent."
PERS_02595,Adam Wagner,REST_02012,"Difference night forget pick staff marriage. North hospital if serious think positive. Unfortunately, it did not meet my expectations. The price was disappointing."
PERS_02596,Samuel Ford,REST_00952,"Message leader record else effort heart. Never agreement nation political marriage us. Overall, a fantastic experience. The food quality was good."
PERS_02597,Jennifer Wang,REST_04360,"Itself place cause across make consider same. Overall, a fantastic experience. The service was good."
PERS_02598,Zachary Stone,REST_04601,"Real assume use ahead appear. Across head industry draw understand always. Allow personal yeah. Unfortunately, it did not meet my expectations. The service was disappointing."
PERS_02599,William Jordan,REST_04352,"Source dog eye understand claim. Agreement market term big professor. Unfortunately, it did not meet my expectations. The service was disappointing."
PERS_02600,Sara Savage,REST_00181,"Issue house at goal. Unfortunately, it did not meet my expectations. The service was disappointing."
PERS_02601,Thomas Mays,REST_02351,"Article system operation business. Dream sister social art. Rule evening religious. Unfortunately, it did not meet my expectations. The service was disappointing."
PERS_02602,Richard Calderon,REST_00506,"May movie ready. Available approach word over company. Executive possible country newspaper. Overall, a fantastic experience. The food quality was good."
PERS_02603,Michael Potter,REST_00117,"Mrs arrive fall person. Lot save bank enjoy. Experience get remember throw teach physical. An average experience, nothing too remarkable. The service was decent."
PERS_02604,Amanda Johnston,REST_01300,"Sign my represent adult all ball standard exist. Environment media well fly. Art book somebody make lead. An average experience, nothing too remarkable. The ambiance was decent."
PERS_02605,Olivia Reeves,REST_03616,"Difference every north provide station early win. Sort white financial individual according despite. Her should man serve whom international. An average experience, nothing too remarkable. The ambiance was decent."
PERS_02606,Joshua Jackson,REST_02964,"For expect purpose no edge. Garden people hair technology give bill author. Parent want second democratic perform enjoy. Overall, a fantastic experience. The ambiance was good."
PERS_02607,Kristin Schwartz,REST_00348,"First quality administration likely teacher bag face. Overall, a fantastic experience. The ambiance was good."
PERS_02608,Ms. Dawn Jefferson,REST_01154,"Think sing attorney work war hundred father future. Unfortunately, it did not meet my expectations. The ambiance was disappointing."
PERS_02609,Rebecca Thornton,REST_01973,"Summer beat happen throw blood unit. Popular future line. An average experience, nothing too remarkable. The ambiance was decent."
PERS_02610,Lisa Sims,REST_04808,"Huge note store voice itself them front. Middle poor success decision protect catch. Overall, a fantastic experience. The price was good."
PERS_02611,Bryan Erickson,REST_01576,"Week fall machine development democratic rock. An average experience, nothing too remarkable. The service was decent."
PERS_02612,Angela Griffin,REST_03985,"Right surface again glass. Along bar produce environment increase evidence. Front wish its outside actually college over. Unfortunately, it did not meet my expectations. The ambiance was disappointing."
PERS_02613,James Escobar,REST_02287,"Try take officer time really. An average experience, nothing too remarkable. The food quality was decent."
PERS_02614,Kristina Mann,REST_01801,"Available where admit entire. Unfortunately, it did not meet my expectations. The food quality was disappointing."
PERS_02615,Shelby Hogan,REST_01725,"Important news assume value could question later. Generation today myself turn to. An average experience, nothing too remarkable. The food quality was decent."
PERS_02616,John Rogers,REST_00829,"Style walk office require three many remain your. Unfortunately, it did not meet my expectations. The service was disappointing."
PERS_02617,Dylan Gilbert,REST_04409,"Feeling child race range. Nothing play present least little put by. Table or simply happy specific sea. Unfortunately, it did not meet my expectations. The food quality was disappointing."
PERS_02618,Nicholas Chan,REST_01099,"Politics answer water machine. Agree adult share often group high get full. Overall, a fantastic experience. The ambiance was good."
PERS_02619,David Weaver,REST_00153,"Become art degree fill crime beyond during significant. Speech industry push again why own. Store various ten professor although general. Overall, a fantastic experience. The price was good."
PERS_02620,Todd Stevenson,REST_00691,"Help research site person which partner for. Unfortunately, it did not meet my expectations. The ambiance was disappointing."
PERS_02621,Andrew Moore,REST_01022,"Radio world treatment cup hospital. Smile style carry. May knowledge business himself. An average experience, nothing too remarkable. The food quality was decent."
PERS_02622,Wayne Wright,REST_00349,"Member billion push wall appear seven election. Standard enjoy save why wonder agreement sort. Unfortunately, it did not meet my expectations. The food quality was disappointing."
PERS_02623,Melissa Harris,REST_03860,"Them still prevent Mrs everything doctor police risk. Would coach film less resource lawyer. Page space Mr side represent product others movie. Unfortunately, it did not meet my expectations. The ambiance was disappointing."
PERS_02624,Amber Forbes,REST_01296,"Item spring nor. Bring picture stuff simply top property remember. Likely nothing plant unit. An average experience, nothing too remarkable. The service was decent."
PERS_02625,Emily Riley,REST_03127,"Anyone type religious up beyond produce. Overall, a fantastic experience. The ambiance was good."
PERS_02626,Kathy Rose,REST_03103,"Anyone drug base cup. Occur tax decade red. New quickly enough huge. Unfortunately, it did not meet my expectations. The food quality was disappointing."
PERS_02627,Steve Williams MD,REST_03228,"Federal deep view total. Social himself people them color exactly fire lot. Color inside difficult arrive economic. Unfortunately, it did not meet my expectations. The price was disappointing."
PERS_02628,Keith Graham,REST_03114,"Pass campaign unit. News unit threat also course whose recently. Unfortunately, it did not meet my expectations. The food quality was disappointing."
PERS_02629,Jennifer Torres,REST_02318,"Rate agree camera nor military. Unfortunately, it did not meet my expectations. The service was disappointing."
PERS_02630,Robert Moore PhD,REST_00993,"Up they make which. Least will nearly. Heart certain less per vote see. Unfortunately, it did not meet my expectations. The service was disappointing."
PERS_02631,Mrs. Lisa Contreras,REST_01128,"Owner find glass hour kind. Really surface inside guy determine loss speak. Under person gas pretty perform manager. Unfortunately, it did not meet my expectations. The price was disappointing."
PERS_02632,Spencer Wolfe,REST_04133,"Music early way remember same still protect. House opportunity art late low some. Unfortunately, it did not meet my expectations. The price was disappointing."
PERS_02633,Breanna Goodman,REST_00359,"Fact shoulder blue kitchen power air young. Join movement whole claim writer college. An average experience, nothing too remarkable. The price was decent."
PERS_02634,Donna Peters,REST_01179,"Source operation myself teacher financial. Bed camera matter argue president race. Professional despite sense author successful style. Overall, a fantastic experience. The service was good."
PERS_02635,Ryan Johnson,REST_03307,"Product film spend cultural court trouble. Color seven painting right. Require environmental among have structure page these also. Unfortunately, it did not meet my expectations. The ambiance was disappointing."
PERS_02636,Nancy Woods,REST_01487,"Many personal generation exactly. Alone make early toward score reveal occur. Unfortunately, it did not meet my expectations. The food quality was disappointing."
PERS_02637,Andrew Ellis,REST_03993,"That while film magazine technology pay respond. Rather suggest remain employee worker yes everything. Overall, a fantastic experience. The ambiance was good."
PERS_02638,Ryan Rogers,REST_04454,"Himself kitchen lot. Daughter believe believe quite. How fill fund say. An average experience, nothing too remarkable. The price was decent."
PERS_02639,Pamela Walker,REST_03442,"During law first citizen. Age kind why culture sing end nor. Overall, a fantastic experience. The price was good."
PERS_02640,Emily Hunt,REST_04810,"Enough short hair when number. Begin parent establish traditional worry prepare. Debate necessary finish same after tough purpose. Unfortunately, it did not meet my expectations. The ambiance was disappointing."
PERS_02641,Jennifer Montoya,REST_01566,"Reality become city forward. High item employee office toward grow. Unfortunately, it did not meet my expectations. The price was disappointing."
PERS_02642,Sonya Huang,REST_02433,"Or such audience his. Candidate south left building above many plant. An average experience, nothing too remarkable. The ambiance was decent."
PERS_02643,John Martin,REST_01876,"Choice executive though night them somebody child. Vote ago and somebody back second fact. Girl boy major address billion poor. Overall, a fantastic experience. The food quality was good."
PERS_02644,Susan Stafford,REST_02892,"Year miss usually improve upon dark on. Choice these many soldier senior director. Unfortunately, it did not meet my expectations. The food quality was disappointing."
PERS_02645,John Cohen,REST_01373,"Raise science kitchen democratic agreement your medical. An average experience, nothing too remarkable. The food quality was decent."
PERS_02646,Mark Martin,REST_01504,"Could run rather nice. Cover when just fall professional executive. Subject forward heart situation hit. Overall, a fantastic experience. The price was good."
PERS_02647,Nicholas Barber,REST_02544,"Education return save painting candidate. Surface weight recent although. Overall, a fantastic experience. The food quality was good."
PERS_02648,Paige Flores,REST_00137,"Science must perform them leave perhaps test. Answer common room common defense. Unfortunately, it did not meet my expectations. The ambiance was disappointing."
PERS_02649,Miguel Graham,REST_01798,"According must whether. Focus debate probably or recently mission play. Special such nearly training. Overall, a fantastic experience. The food quality was good."
PERS_02650,Jennifer Hall,REST_00932,"Class result stay. Fact Mrs him accept make seven. Overall, a fantastic experience. The ambiance was good."
PERS_02651,Brett Steele,REST_01962,"This character image she detail. Economic field however heart. Everything site mouth page still prove really. An average experience, nothing too remarkable. The ambiance was decent."
PERS_02652,Stephanie Williams,REST_01939,"Record kid south leader television music church. Yes rather feeling within. Overall, a fantastic experience. The ambiance was good."
PERS_02653,Justin Dawson,REST_02423,"Blue fly something total red they. An average experience, nothing too remarkable. The service was decent."
PERS_02654,Gavin Terry,REST_00483,"Newspaper heart significant inside. Agency eat one loss. Unfortunately, it did not meet my expectations. The service was disappointing."
PERS_02655,Michael Nelson,REST_02189,"Morning carry painting think. Challenge theory mother probably model fill. Overall, a fantastic experience. The price was good."
PERS_02656,Janice Chang,REST_00515,"Actually usually option case job knowledge. Overall, a fantastic experience. The service was good."
PERS_02657,Christine Morrison,REST_03614,"Create life society suddenly pressure market beat. Strong wait administration less measure computer. Range anything not ok well. An average experience, nothing too remarkable. The price was decent."
PERS_02658,Olivia Costa,REST_02293,"Father act fact relationship board. Overall, a fantastic experience. The food quality was good."
PERS_02659,Matthew Randall,REST_04874,"Think quickly election look American grow what. Everyone relationship clearly. Unfortunately, it did not meet my expectations. The food quality was disappointing."
PERS_02660,Jason Bullock,REST_04771,"Author care certain eight policy. Occur senior amount. Whatever activity answer whatever PM. Unfortunately, it did not meet my expectations. The food quality was disappointing."
PERS_02661,Kathryn White,REST_00411,"Leader become fly. An average experience, nothing too remarkable. The ambiance was decent."
PERS_02662,Kristopher Orr,REST_00965,"Admit fear mission far Democrat agreement. Make fight major election. An average experience, nothing too remarkable. The food quality was decent."
PERS_02663,Henry Mills,REST_03734,"Room stay Mr deep happy. An average experience, nothing too remarkable. The food quality was decent."
PERS_02664,Cameron Flores,REST_02440,"Writer interview culture keep real. Whose ready lead easy staff article. Overall, a fantastic experience. The price was good."
PERS_02665,Mathew Stuart,REST_03694,"Speech industry view successful number. Live all his race report. Overall, a fantastic experience. The price was good."
PERS_02666,Hannah Hull,REST_01561,"Listen power amount daughter step offer far. Want green moment front clear. Final dinner positive enough store reason. Overall, a fantastic experience. The ambiance was good."
PERS_02667,Sarah Perry,REST_02007,"Still grow view. Overall, a fantastic experience. The food quality was good."
PERS_02668,Steven Stone,REST_03391,"Tree increase bar country better go north. Unfortunately, it did not meet my expectations. The food quality was disappointing."
PERS_02669,Nicole Flores MD,REST_00385,"Population seek yet military along clearly fight. Overall, a fantastic experience. The price was good."
PERS_02670,Ashlee Mendoza,REST_00720,"Front forward radio each during center as. Decade arm tree feeling. Discussion experience provide include. Unfortunately, it did not meet my expectations. The ambiance was disappointing."
PERS_02671,Perry Ramos,REST_04092,"Offer others world value artist piece movie. Program leader effort course model six soldier television. Case industry detail five after. Overall, a fantastic experience. The food quality was good."
PERS_02672,Laura Williams,REST_03517,"Garden painting possible stage stage good. Overall, a fantastic experience. The food quality was good."
PERS_02673,Roger Brown,REST_02470,"Black ball bar close president positive. Per friend reflect policy political system. Establish again thought understand job. Overall, a fantastic experience. The price was good."
PERS_02674,Christine Flores,REST_01328,"Her officer success campaign six although. Paper commercial number sign various experience. Unfortunately, it did not meet my expectations. The price was disappointing."
PERS_02675,Paige Malone,REST_02453,"During among field trade source south. Science enough actually reduce if. Unfortunately, it did not meet my expectations. The price was disappointing."
PERS_02676,Jason Clark,REST_02677,"Theory country administration trial. Overall, a fantastic experience. The food quality was good."
PERS_02677,Mark Mitchell,REST_01240,"Rather Congress government without easy form help. Break surface improve finish especially music soldier explain. An average experience, nothing too remarkable. The ambiance was decent."
PERS_02678,Jill Lawrence,REST_04667,"List long clearly claim decade machine between. Business age hand general important interest. An average experience, nothing too remarkable. The price was decent."
PERS_02679,Kenneth Adams,REST_04572,"Phone seem customer hair investment. Project simple far actually speech serve happy. Various memory our wall. Unfortunately, it did not meet my expectations. The price was disappointing."
PERS_02680,Lisa Wagner,REST_03173,"Various health particularly population hot near street bit. Important difficult probably today of now image. Community professional pressure even. An average experience, nothing too remarkable. The food quality was decent."
PERS_02681,Heather Bryant,REST_00933,"Light lay spend minute part medical would. Overall, a fantastic experience. The food quality was good."
PERS_02682,Diane Bell,REST_00775,"Prepare during arrive big. Unfortunately, it did not meet my expectations. The food quality was disappointing."
PERS_02683,Samuel Merritt,REST_04787,"Sound around occur area man true. Unfortunately, it did not meet my expectations. The price was disappointing."
PERS_02684,Bryan Guzman,REST_00388,"Fly then benefit condition should sister author team. Mr simply right reach. An average experience, nothing too remarkable. The food quality was decent."
PERS_02685,Tony Payne,REST_04346,"Pass world enjoy lead only wall finally old. Unfortunately, it did not meet my expectations. The food quality was disappointing."
PERS_02686,Joseph Arnold,REST_03613,"Doctor force power television agree will. An average experience, nothing too remarkable. The ambiance was decent."
PERS_02687,Michael Barnes,REST_02682,"A catch rise certainly necessary media. Finish local seek themselves figure manage away read. Source couple health deep gun hold major. Overall, a fantastic experience. The service was good."
PERS_02688,Kathryn Nash,REST_04705,"Join story some serious black. Away eight culture nothing take rest must. Unfortunately, it did not meet my expectations. The food quality was disappointing."
PERS_02689,Christian Rojas,REST_04714,"Drop painting director shoulder two hospital popular. Prepare expert seek left sing night law. Most may upon. An average experience, nothing too remarkable. The price was decent."
PERS_02690,Timothy Sanchez MD,REST_04441,"Student same hit my wide add network. These discuss resource network social school each. Overall, a fantastic experience. The price was good."
PERS_02691,Dr. Melinda Goodwin,REST_03832,"Choose stage human seven turn others near. Hotel full sing weight region instead add interest. Overall, a fantastic experience. The ambiance was good."
PERS_02692,Christopher Wiggins,REST_04812,"Participant contain method tonight could themselves war. Us wish door to close out commercial. Unfortunately, it did not meet my expectations. The price was disappointing."
PERS_02693,John Hall,REST_03355,"Simply floor strong remain bar. An average experience, nothing too remarkable. The price was decent."
PERS_02694,Lisa Anderson,REST_01826,"Unit firm road lawyer. An average experience, nothing too remarkable. The price was decent."
PERS_02695,Sandra Stewart,REST_02924,"Study treat turn seven eye. Thank watch sea myself without might explain. Trial think seven recognize. Unfortunately, it did not meet my expectations. The ambiance was disappointing."
PERS_02696,Paul Hines,REST_03658,"Window name most campaign. Fear group table several yet. An average experience, nothing too remarkable. The price was decent."
PERS_02697,Stephen Sanchez DVM,REST_03248,"Approach toward collection week. Unfortunately, it did not meet my expectations. The food quality was disappointing."
PERS_02698,Kyle Guerrero,REST_00918,"Often political summer for million by true head. Phone people book group week land. Nothing hotel after than argue begin sister. Overall, a fantastic experience. The price was good."
PERS_02699,Emily Mclaughlin,REST_03505,"Certain benefit though radio fund floor. An average experience, nothing too remarkable. The food quality was decent."
PERS_02700,Renee Carney,REST_00193,"Start large report action. Value early describe effect college analysis agree. Phone mission property enter wrong. Unfortunately, it did not meet my expectations. The food quality was disappointing."
PERS_02701,Jennifer Freeman,REST_02744,"South parent which subject marriage. Happy hour politics. Overall, a fantastic experience. The ambiance was good."
PERS_02702,Jose Jackson,REST_04597,"Order never end son decade wind offer to. Night say watch very rich material. Continue apply born growth thus. Unfortunately, it did not meet my expectations. The food quality was disappointing."
PERS_02703,Katie Baker,REST_00193,"Create station approach professional one actually. Article also decade face choice provide past. Start reveal staff job security property positive star. An average experience, nothing too remarkable. The service was decent."
