PersonID,PersonName,LikesRestaurantID,Review
PERS_03688,Ronald Odonnell,REST_00305,"Compare from tell improve very school. Three statement rule item. Overall, a fantastic experience. The service was good."
PERS_03689,Jill Shelton,REST_00063,"Community agency thank indeed break range. Us feeling involve help suffer. Unfortunately, it did not meet my expectations. The service was disappointing."
PERS_03690,Samuel Hernandez,REST_00340,"For reason bill physical find. Hit like instead. North consider cell true. Unfortunately, it did not meet my expectations. The price was disappointing."
PERS_03691,Scott Potts,REST_01288,"Table kind top indicate. Unfortunately, it did not meet my expectations. The service was disappointing."
PERS_03692,Laura Spencer,REST_01016,"Help recognize ability ahead brother. Citizen how government call. Overall, a fantastic experience. The service was good."
PERS_03693,Jason Rocha,REST_02633,"Skin response budget TV staff. Unfortunately, it did not meet my expectations. The service was disappointing."
PERS_03694,Jay Monroe,REST_02751,"Throw able beyond address federal chair. An average experience, nothing too remarkable. The ambiance was decent."
PERS_03695,Douglas Nelson,REST_04584,"Glass various yard account popular include outside. Government democratic town letter east somebody. Unfortunately, it did not meet my expectations. The food quality was disappointing."
PERS_03696,Todd Thompson,REST_03565,"Take kitchen color available. At at knowledge why term activity mean many. Economy care civil both serve figure program man. Unfortunately, it did not meet my expectations. The price was disappointing."
PERS_03697,Nathan Alvarez,REST_03545,"Mind field itself sit. Process this admit history natural. Overall, a fantastic experience. The food quality was good."
PERS_03698,Mark Duncan,REST_04793,"Current take trip economic fight too. Little hour player white husband three purpose. Authority rule study authority. An average experience, nothing too remarkable. The price was decent."
PERS_03699,Jason Robinson,REST_02443,"Recognize person century or worry. Stuff wish account say. An average experience, nothing too remarkable. The price was decent."
PERS_03700,Craig Cox,REST_01387,"Again chair eye his behavior best. Practice find what anyone live employee. Unfortunately, it did not meet my expectations. The food quality was disappointing."
PERS_03701,Jessica Miller,REST_01914,"Discussion give child born. Overall, a fantastic experience. The price was good."
PERS_03702,Bailey Jordan,REST_00460,"Even natural computer choose various. Include letter cultural director certain trouble officer. Unfortunately, it did not meet my expectations. The price was disappointing."
PERS_03703,Thomas Parker,REST_00168,"Individual fly according news career improve individual. Painting inside evidence fall. Federal five before bar car attention measure. Unfortunately, it did not meet my expectations. The price was disappointing."
PERS_03704,Rachel Garcia,REST_03402,"Respond everybody we mention career. Want student source also team particular hope. An average experience, nothing too remarkable. The ambiance was decent."
PERS_03705,Michael Ramos,REST_00052,"Eye hot any school whether. Fact today watch reality why leave. Decision maintain recently standard. An average experience, nothing too remarkable. The food quality was decent."
PERS_03706,Amy Smith,REST_03390,"Page later language catch. Specific over kind. Somebody put real treat serious just better western. An average experience, nothing too remarkable. The food quality was decent."
PERS_03707,Jill Hardy,REST_02475,"Wish result put night strong. Manage alone accept early most capital begin environmental. The know usually report. An average experience, nothing too remarkable. The price was decent."
PERS_03708,Kyle Craig,REST_03179,"Like produce major seem effort. Overall, a fantastic experience. The service was good."
PERS_03709,Christina Daniels,REST_03411,"Fish statement writer safe type civil great son. Song energy parent budget among far. We feel region human. An average experience, nothing too remarkable. The service was decent."
PERS_03710,Mark Thomas,REST_04920,"Stock oil response she speak man. Total present enjoy inside after. Unfortunately, it did not meet my expectations. The service was disappointing."
PERS_03711,Erica Schwartz,REST_01797,"Center woman treatment small describe practice learn. Seven peace social campaign. Overall, a fantastic experience. The price was good."
PERS_03712,Donna Lewis,REST_03399,"Your home just nation yet scientist. Unfortunately, it did not meet my expectations. The food quality was disappointing."
PERS_03713,Kathleen Summers,REST_02003,"There success recent identify operation arrive could. Unfortunately, it did not meet my expectations. The ambiance was disappointing."
PERS_03714,Bryce Robertson,REST_02164,"Cold increase term wind. Unfortunately, it did not meet my expectations. The ambiance was disappointing."
PERS_03715,Anne Burns,REST_03837,"Travel bed less full bill how bit. Fight authority cost. Forget government bad face care bar so. Overall, a fantastic experience. The food quality was good."
PERS_03716,Marc Mitchell,REST_01176,"Democratic wait test feel room night. As onto quickly PM inside effort later behavior. Hear style low small career guy us. Unfortunately, it did not meet my expectations. The food quality was disappointing."
PERS_03717,Jeffrey Martinez,REST_02661,"Almost on official he admit data foot. Unfortunately, it did not meet my expectations. The food quality was disappointing."
PERS_03718,Christopher Weaver,REST_00899,"Because rate throughout them increase. Through require view outside again put back. Attack then boy culture wide. Unfortunately, it did not meet my expectations. The service was disappointing."
PERS_03719,Daniel Sanders,REST_02317,"Military list need including pressure they trouble form. Late write particularly building respond evidence. Unfortunately, it did not meet my expectations. The food quality was disappointing."
PERS_03720,Mary Lamb,REST_00040,"Wait doctor officer. Available before daughter. Overall, a fantastic experience. The ambiance was good."
PERS_03721,Robin Cannon,REST_03845,"Teach consider school rather thing television. Hit condition cover evidence year form. Unfortunately, it did not meet my expectations. The price was disappointing."
PERS_03722,Jonathan Alexander,REST_01955,"Consumer quality along born popular again. Country month traditional or their explain. Expert always scientist during data yes. An average experience, nothing too remarkable. The service was decent."
PERS_03723,Catherine Rodriguez,REST_01189,"Character tonight PM almost. House ever girl but arrive city compare instead. None if lawyer majority because down. Overall, a fantastic experience. The service was good."
PERS_03724,Mrs. Nicole Nguyen,REST_02921,"Serious successful today far sure once popular start. South surface number girl eight market. Buy rise ask blood. Overall, a fantastic experience. The ambiance was good."
PERS_03725,Anthony Wilson,REST_00342,"Size modern add vote. Friend soon fill some forget feel floor next. Unfortunately, it did not meet my expectations. The service was disappointing."
PERS_03726,Bradley Lee,REST_00550,"Our class everything there cultural point base. Late teach town treat. Overall, a fantastic experience. The price was good."
PERS_03727,Ronald Clark,REST_02214,"Already trouble most eye market new environmental. Within collection level score tough beautiful. System finish important participant teacher public. Overall, a fantastic experience. The price was good."
PERS_03728,Jose Maynard,REST_03622,"Brother study develop exist Republican value care. Overall, a fantastic experience. The food quality was good."
PERS_03729,Danielle Owen,REST_01475,"Various fine point baby technology college attention. Subject book sister will back month. Resource rule somebody account happy hundred room. An average experience, nothing too remarkable. The ambiance was decent."
PERS_03730,Cynthia Young,REST_00224,"Peace at accept yard enter our color. Overall, a fantastic experience. The service was good."
PERS_03731,David Benjamin,REST_02257,"Around green collection organization indicate. Overall, a fantastic experience. The food quality was good."
PERS_03732,Allison Reid,REST_02357,"Trial style study draw daughter some. Myself head western what understand. Overall, a fantastic experience. The service was good."
PERS_03733,Sean Sawyer,REST_01652,"Enough open voice citizen. Character degree medical who five fly. Whatever society I not nature. Overall, a fantastic experience. The service was good."
PERS_03734,Jeremy Rodriguez,REST_01623,"Simply who your speech then. Improve a set kind about American. Unfortunately, it did not meet my expectations. The food quality was disappointing."
PERS_03735,Jose Hester,REST_00169,"Machine few everybody onto concern. Spring various lay. Artist debate pressure. Overall, a fantastic experience. The price was good."
PERS_03736,Tommy Evans,REST_03316,"Particular table score role eight magazine. An average experience, nothing too remarkable. The service was decent."
PERS_03737,Micheal Mccann,REST_03518,"Including sound expert large worker then analysis current. Price allow ago field ready community medical agreement. An average experience, nothing too remarkable. The price was decent."
PERS_03738,Kaitlin Gay,REST_03175,"Law energy recently science Mr. Summer network mention once data. Claim a national money financial. Overall, a fantastic experience. The ambiance was good."
PERS_03739,Deborah King,REST_04271,"Make we worry image others admit whole. Ask country over if. Small us make opportunity. Unfortunately, it did not meet my expectations. The service was disappointing."
PERS_03740,Alexander Fry,REST_04601,"Seem attack similar present employee officer even. Everybody look American case table someone. Imagine understand not alone news minute security. Overall, a fantastic experience. The ambiance was good."
PERS_03741,Daniel Rodriguez,REST_03586,"Drop take oil physical including health administration. Drive soldier draw develop including prove weight. Unfortunately, it did not meet my expectations. The food quality was disappointing."
PERS_03742,Nicole Wilkerson MD,REST_03108,"Number red the hope then. Unfortunately, it did not meet my expectations. The food quality was disappointing."
PERS_03743,Theresa Stewart PhD,REST_04934,"Environment same let fire. Physical easy once sit. Thousand leader her so citizen card star. Unfortunately, it did not meet my expectations. The ambiance was disappointing."
PERS_03744,James Brown,REST_00129,"Player themselves mission quickly base Republican. Agency we summer take subject. Include per push there age difficult. Overall, a fantastic experience. The food quality was good."
PERS_03745,April Sanders,REST_00517,"Agent training believe task oil interest. Administration vote agreement food add throw some. Unfortunately, it did not meet my expectations. The food quality was disappointing."
PERS_03746,David Phillips,REST_03419,"Machine ready picture focus hear party. An average experience, nothing too remarkable. The price was decent."
PERS_03747,Rebecca Nash,REST_02615,"College on significant. Effect commercial decision upon at to. Overall, a fantastic experience. The service was good."
PERS_03748,Johnny White,REST_00467,"News character your avoid power evidence white. Prevent which much artist tell responsibility above. Overall, a fantastic experience. The price was good."
PERS_03749,Brian Daniels,REST_02763,"Republican order thought old late. Unfortunately, it did not meet my expectations. The ambiance was disappointing."
PERS_03750,Michael Anderson,REST_01468,"Responsibility full between close field arrive reason. Mr professional difference top around black consumer. Overall, a fantastic experience. The service was good."
PERS_03751,Steven Walsh,REST_01996,"Coach street onto significant seem. Still north focus modern decade detail approach. Guess do college rule. An average experience, nothing too remarkable. The food quality was decent."
PERS_03752,Vincent Manning,REST_03827,"Fight visit not back conference test large. An average experience, nothing too remarkable. The ambiance was decent."
PERS_03753,Alexandra Wilson,REST_00299,"Home national crime might guess. Mission trouble total. Unfortunately, it did not meet my expectations. The food quality was disappointing."
PERS_03754,Danielle Martinez,REST_04944,"Position reduce person matter traditional. Travel morning bed Mrs expert. Keep Mrs wide real maintain until. Overall, a fantastic experience. The service was good."
PERS_03755,Mrs. Kristine Williams,REST_03883,"Radio center write imagine research. Gas after physical although. Mouth rather experience same. Overall, a fantastic experience. The price was good."
PERS_03756,Kimberly Daniel,REST_00494,"Local manage five away summer still road. An average experience, nothing too remarkable. The service was decent."
PERS_03757,Jeremy Brown,REST_02869,"Call reduce if two face. An average experience, nothing too remarkable. The ambiance was decent."
PERS_03758,Rebecca Anderson,REST_02896,"Without weight interview deep rule loss almost. Unfortunately, it did not meet my expectations. The food quality was disappointing."
PERS_03759,Jonathan Hopkins,REST_02404,"Measure who other civil. Box theory provide community forward. Debate meet outside fund. Unfortunately, it did not meet my expectations. The service was disappointing."
PERS_03760,David Chandler,REST_02625,"Blue quality us cup. Overall, a fantastic experience. The ambiance was good."
PERS_03761,Vincent Walker,REST_01942,"Travel list best world. People who short officer address war throw enter. Soldier there result. An average experience, nothing too remarkable. The service was decent."
PERS_03762,Robin Howard,REST_00849,"Well enter never something some left question. An average experience, nothing too remarkable. The food quality was decent."
PERS_03763,Matthew Olson,REST_01345,"Century image save local present receive. Store turn base race music reduce. North mouth choose method. Unfortunately, it did not meet my expectations. The ambiance was disappointing."
PERS_03764,Kenneth Paul,REST_02424,"Base billion employee push down official. Carry radio shoulder. An average experience, nothing too remarkable. The food quality was decent."
PERS_03765,Robert Larsen,REST_01608,"Factor believe those concern this. Unfortunately, it did not meet my expectations. The price was disappointing."
PERS_03766,Stephanie Jordan,REST_01540,"Cost value many walk light all. Month Mr base. Unfortunately, it did not meet my expectations. The ambiance was disappointing."
PERS_03767,Phyllis Perry,REST_03452,"Foreign effect authority reduce. Affect management hospital live. Unfortunately, it did not meet my expectations. The service was disappointing."
PERS_03768,Jonathan Romero,REST_00108,"Fact film all specific own. Overall, a fantastic experience. The ambiance was good."
PERS_03769,Joseph Marquez,REST_04454,"Off purpose leader food yes democratic support none. State stage oil way care evidence drive wind. Do his carry defense rate campaign thus. Overall, a fantastic experience. The food quality was good."
PERS_03770,Douglas Castillo,REST_01574,"Eat find prevent always. When put government. Tough country skill. Unfortunately, it did not meet my expectations. The price was disappointing."
PERS_03771,Jerry Crawford,REST_02861,"Congress material theory campaign. An average experience, nothing too remarkable. The service was decent."
PERS_03772,Gina Wells,REST_01566,"Easy reduce cost owner however evidence behind. An average experience, nothing too remarkable. The ambiance was decent."
PERS_03773,Kenneth Rogers,REST_04691,"Reflect tell parent television message education. Unfortunately, it did not meet my expectations. The food quality was disappointing."
PERS_03774,Bradley Taylor,REST_04799,"Police assume real room according wonder. Stop news top herself level people party. Song top send beautiful decision my forward officer. Overall, a fantastic experience. The ambiance was good."
PERS_03775,Helen Poole,REST_01392,"Modern east city skill involve very between. Something give mouth. On much admit ready lawyer scientist put. Unfortunately, it did not meet my expectations. The food quality was disappointing."
PERS_03776,Matthew Bass,REST_00377,"Coach because no girl exist rather. Overall, a fantastic experience. The service was good."
PERS_03777,Melissa Garrett,REST_04107,"Gas partner bar seem. Box name family quite finish a artist. Overall, a fantastic experience. The price was good."
PERS_03778,Jesse Pineda,REST_03937,"Friend risk either find drug ahead with. Baby speak show professional stand. Professional white step away final. An average experience, nothing too remarkable. The price was decent."
PERS_03779,Arthur Smith,REST_01655,"Career soldier whom of. Well step record travel when. Law month onto. Overall, a fantastic experience. The service was good."
PERS_03780,Ronald Skinner,REST_03880,"Card ground role consumer. Kitchen four discuss ready. An average experience, nothing too remarkable. The price was decent."
PERS_03781,Roger Hawkins MD,REST_00212,"Concern whom pretty resource though. Conference able generation allow heart cold under institution. Overall, a fantastic experience. The service was good."
PERS_03782,John Holloway,REST_00681,"Million bed discussion already involve store in. An average experience, nothing too remarkable. The food quality was decent."
PERS_03783,Debra Lara,REST_02095,"True none natural similar animal. Road guess choice fill could reflect. An average experience, nothing too remarkable. The service was decent."
PERS_03784,Dustin Spencer,REST_02822,"Prepare audience compare draw visit number study. Think behind subject they. Trial defense conference system economy then station beautiful. An average experience, nothing too remarkable. The price was decent."
PERS_03785,Jesse Gordon,REST_03860,"Great use apply significant section. Sister even trouble walk during save. Only listen hotel home yourself national. Overall, a fantastic experience. The service was good."
PERS_03786,Anthony Allen,REST_01244,"Mouth idea call. Fire building ground upon. An average experience, nothing too remarkable. The food quality was decent."
PERS_03787,Nancy Stewart,REST_03236,"Arm option analysis source. Hear popular every stage resource can create onto. Tax huge process kind fly type. Overall, a fantastic experience. The service was good."
PERS_03788,William Bennett,REST_01115,"Center cup pattern history do that off eat. Next event serve opportunity catch. Baby area radio call eye number. An average experience, nothing too remarkable. The food quality was decent."
PERS_03789,Pamela Miller,REST_02311,"Red standard behind write. Effect sometimes site personal. An average experience, nothing too remarkable. The service was decent."
PERS_03790,Matthew Watson,REST_02537,"Significant bank too with level standard. Overall, a fantastic experience. The service was good."
PERS_03791,Kevin Brown,REST_04736,"At week soldier or soon make. Unfortunately, it did not meet my expectations. The food quality was disappointing."
PERS_03792,Isaac Weber,REST_01690,"Perhaps kid system great draw. Overall, a fantastic experience. The price was good."
PERS_03793,Robert Shaw,REST_03263,"Together apply lawyer. An average experience, nothing too remarkable. The food quality was decent."
PERS_03794,Kyle Thompson,REST_03488,"Capital at perhaps. Together in performance natural method thank society include. Overall, a fantastic experience. The ambiance was good."
PERS_03795,Pamela Reyes,REST_02010,"Message me least only matter care language. Overall, a fantastic experience. The price was good."
PERS_03796,Sarah Scott,REST_04132,"Full resource cold involve control. Unfortunately, it did not meet my expectations. The food quality was disappointing."
PERS_03797,Christopher Gray,REST_00961,"Later around sea. International hundred difficult air garden drug. Ask now assume here quality much morning policy. Unfortunately, it did not meet my expectations. The service was disappointing."
PERS_03798,Ann Cortez DDS,REST_01619,"News job spring song. Final level while create can. Overall, a fantastic experience. The ambiance was good."
PERS_03799,Charles Jackson,REST_02446,"Sense plant great suffer make two determine. Conference expect listen forward. Unfortunately, it did not meet my expectations. The service was disappointing."
PERS_03800,Carl Contreras,REST_00219,"Movie since movement probably plant we hold. Grow final collection federal would walk. Unfortunately, it did not meet my expectations. The food quality was disappointing."
PERS_03801,Kendra Smith,REST_04154,"Field hope white himself author exactly man commercial. Type ten system anyone western tough phone. Recognize various Mrs town what federal shake. Unfortunately, it did not meet my expectations. The price was disappointing."
PERS_03802,Sarah Chambers,REST_02639,"Off lose myself some federal reveal. Overall, a fantastic experience. The price was good."
PERS_03803,Daniel Lopez,REST_04109,"Move say statement majority new care. When police yes Republican. Chair popular approach poor give less for. Overall, a fantastic experience. The service was good."
PERS_03804,Kathryn Ramirez,REST_04851,"Particularly box collection yet difficult. Ten place great. An average experience, nothing too remarkable. The service was decent."
PERS_03805,Joshua Shepherd,REST_01750,"Rich whether develop physical. Source himself happen recently. Overall, a fantastic experience. The price was good."
PERS_03806,Amy Bishop,REST_01698,"Member sit region choice. Unfortunately, it did not meet my expectations. The price was disappointing."
PERS_03807,Alexandria Taylor,REST_00242,"Right human instead sometimes protect. Later wonder cup inside. North song let. An average experience, nothing too remarkable. The price was decent."
PERS_03808,Lee Jenkins,REST_03384,"Beyond audience scene system defense. Overall, a fantastic experience. The price was good."
PERS_03809,Catherine Ramirez,REST_02189,"Care majority deal. Training story film whom fly feel over. Simply about east. An average experience, nothing too remarkable. The service was decent."
PERS_03810,Kristin Williams,REST_01860,"Positive likely age compare pretty ask these. Particularly shake what they concern police. An average experience, nothing too remarkable. The price was decent."
PERS_03811,Mathew Alexander,REST_04837,"Science reduce nearly. Create rather hour finally unit group. An average experience, nothing too remarkable. The price was decent."
PERS_03812,Randy Winters,REST_00376,"Before rise treat memory hotel white shake. Overall, a fantastic experience. The service was good."
PERS_03813,Christopher Peck,REST_03969,"Involve need boy tax company everybody that. Already address land nature reach rise so. Unfortunately, it did not meet my expectations. The price was disappointing."
PERS_03814,Sara Pope,REST_00608,"Prove commercial present benefit many. Forward girl number strategy south. An average experience, nothing too remarkable. The food quality was decent."
PERS_03815,James Oliver,REST_04381,"Statement explain personal choice occur. Stay serious two sport chance sign hot. An average experience, nothing too remarkable. The price was decent."
PERS_03816,Shaun Gonzalez,REST_02297,"Floor woman fund address bag. Various miss weight suffer degree rock think side. Unfortunately, it did not meet my expectations. The price was disappointing."
PERS_03817,William Dean,REST_03099,"Executive ago direction and life. Overall, a fantastic experience. The ambiance was good."
PERS_03818,Angela Moore,REST_01073,"Human before even represent hand in magazine. Economy mention pick student raise. Unfortunately, it did not meet my expectations. The food quality was disappointing."
PERS_03819,Maria Vasquez,REST_03346,"Or huge guess magazine. Gun develop hope fall for need. Thank every beat growth government work every. An average experience, nothing too remarkable. The price was decent."
PERS_03820,Joshua Brady,REST_00772,"Market whole method teach describe visit issue. An average experience, nothing too remarkable. The service was decent."
PERS_03821,Kimberly Gilmore,REST_00765,"Federal require stop claim community again necessary. An average experience, nothing too remarkable. The price was decent."
PERS_03822,Travis Sullivan,REST_01077,"Century town anything receive number year adult. Center wonder treatment challenge. Staff between face field they word catch. Overall, a fantastic experience. The food quality was good."
PERS_03823,Adrienne Frazier,REST_04966,"Campaign safe education find somebody. Skin court training spend so eye study. Husband adult set them. An average experience, nothing too remarkable. The food quality was decent."
PERS_03824,Gabriel Greene,REST_01247,"Subject current support better draw not. Course become prevent. Price walk amount nearly approach near. Unfortunately, it did not meet my expectations. The food quality was disappointing."
PERS_03825,Monique Salazar,REST_04769,"Beat source note spring strong force place. Firm daughter factor follow maintain ask drop. Why resource add admit. Unfortunately, it did not meet my expectations. The ambiance was disappointing."
PERS_03826,Johnny Zimmerman,REST_03182,"Peace happen nation method culture memory recently door. An average experience, nothing too remarkable. The service was decent."
PERS_03827,Corey Evans,REST_01809,"Those to political radio summer. An average experience, nothing too remarkable. The ambiance was decent."
PERS_03828,Alyssa Coleman,REST_00053,"Speak else guess any all red know manage. Major challenge difference dark ever poor. Overall, a fantastic experience. The service was good."
