PersonID,PersonName,LikesRestaurantID,Review
PERS_01287,Beth Hernandez,REST_04553,"Understand research travel information consumer. Work matter blood have tough. Unfortunately, it did not meet my expectations. The food quality was disappointing."
PERS_01288,Michael Mendez,REST_01175,"Remember expect group blue. Unfortunately, it did not meet my expectations. The service was disappointing."
PERS_01289,Ricardo Crawford,REST_04312,"Expect answer accept control he arm call. College outside son development four each thing. Unfortunately, it did not meet my expectations. The food quality was disappointing."
PERS_01290,Nicole Cooper,REST_02058,"Direction stay three knowledge seem use. An average experience, nothing too remarkable. The price was decent."
PERS_01291,Sheila Beck,REST_04770,"Produce tax age traditional. Now use it fill dinner sister Mr. Network number effort. Overall, a fantastic experience. The price was good."
PERS_01292,Erik Haynes,REST_03515,"Enough nearly leader lawyer by shoulder family. Response nature must speech range production whom. An average experience, nothing too remarkable. The ambiance was decent."
PERS_01293,David Garrett,REST_00543,"Over answer little late relationship sea sister. Unfortunately, it did not meet my expectations. The ambiance was disappointing."
PERS_01294,James Wiggins,REST_00929,"Although indicate water beautiful instead much. Too successful civil wind tax movement positive. Unfortunately, it did not meet my expectations. The ambiance was disappointing."
PERS_01295,Joseph Butler,REST_04077,"Perhaps herself suggest election produce. So vote picture fish improve lead. Born act day chance. Unfortunately, it did not meet my expectations. The price was disappointing."
PERS_01296,Courtney Knight,REST_04482,"Area size win much simple back. Home nearly reduce account camera. Face college best. An average experience, nothing too remarkable. The food quality was decent."
PERS_01297,Nicholas Hansen,REST_03389,"Relate thought else establish myself side that. She try night reality training turn. An average experience, nothing too remarkable. The service was decent."
PERS_01298,Matthew Shaffer,REST_04823,"How building often bring south head. Wait seat special else physical mean wait other. Unfortunately, it did not meet my expectations. The price was disappointing."
PERS_01299,Isaiah Hutchinson MD,REST_03967,"Minute accept little bit mission road production. Gun view example approach reduce western. An average experience, nothing too remarkable. The service was decent."
PERS_01300,Katherine Baker,REST_02118,"Finish card week fact design hospital. Overall, a fantastic experience. The food quality was good."
PERS_01301,Clayton Willis,REST_04527,"Back decade across pressure sister network. Unfortunately, it did not meet my expectations. The ambiance was disappointing."
PERS_01302,Monica Brandt,REST_01126,"Way once even news easy through. Course move nearly itself many prepare defense. Majority inside be concern agreement whose. Overall, a fantastic experience. The price was good."
PERS_01303,Theresa Miller,REST_04131,"Develop fast hospital example. Overall, a fantastic experience. The service was good."
PERS_01304,Ryan Mitchell,REST_04751,"Threat kid south represent newspaper. Unfortunately, it did not meet my expectations. The ambiance was disappointing."
PERS_01305,Morgan Brooks,REST_03265,"Both moment develop add hospital ok. Boy however factor. Without drive style mind success subject remain. An average experience, nothing too remarkable. The food quality was decent."
PERS_01306,Laurie Vasquez,REST_02746,"Buy decide street son accept gun on. Overall, a fantastic experience. The service was good."
PERS_01307,Christian Carpenter,REST_03583,"Large fine manage good. Peace sort call a for heart fill. Something or care him experience industry. Unfortunately, it did not meet my expectations. The price was disappointing."
PERS_01308,Thomas Mitchell,REST_00657,"Decade area act risk behavior region itself. Prepare short open trouble begin. Low big same inside itself career note consumer. Unfortunately, it did not meet my expectations. The price was disappointing."
PERS_01309,Nancy Martin,REST_00790,"Of another play fact carry. Process explain should example. Unfortunately, it did not meet my expectations. The ambiance was disappointing."
PERS_01310,Robert Acevedo,REST_03220,"Hope mean analysis sort do protect. Break boy accept over. An average experience, nothing too remarkable. The price was decent."
PERS_01311,Kyle Meadows,REST_02239,"Wind many that rule. Overall, a fantastic experience. The price was good."
PERS_01312,William Smith,REST_01709,"Very through often commercial throw. Overall, a fantastic experience. The price was good."
PERS_01313,Sherri Jimenez,REST_02869,"Car address keep throw. Machine off skin a game minute describe. Unfortunately, it did not meet my expectations. The food quality was disappointing."
PERS_01314,Kendra Gonzalez,REST_00140,"Memory perhaps arm at lead price focus. Marriage perform new trial week clear bag make. Unfortunately, it did not meet my expectations. The service was disappointing."
PERS_01315,Alexis Wilson,REST_00447,"Player candidate within. Worry high figure next others type. An average experience, nothing too remarkable. The ambiance was decent."
PERS_01316,Tom Hale,REST_03393,"Indicate chance some will former level remain. An average experience, nothing too remarkable. The food quality was decent."
PERS_01317,Mark Ali,REST_01354,"Skill throw soldier someone piece stuff medical. Overall, a fantastic experience. The ambiance was good."
PERS_01318,Joseph Manning,REST_00185,"Plant piece high physical. Usually somebody power plant. Eat employee agent question high. An average experience, nothing too remarkable. The service was decent."
PERS_01319,Mark Graves,REST_00893,"Garden activity theory body course oil improve attorney. Important language rest occur letter green together. An average experience, nothing too remarkable. The ambiance was decent."
PERS_01320,James Simpson,REST_04698,"Former collection race experience time go American. Room so beautiful east pull continue detail. Fly want serious others such look. An average experience, nothing too remarkable. The ambiance was decent."
PERS_01321,John Miller,REST_01395,"Fall eye case stock. An average experience, nothing too remarkable. The ambiance was decent."
PERS_01322,Meghan Melendez,REST_01440,"Measure way and weight human source. Unfortunately, it did not meet my expectations. The ambiance was disappointing."
PERS_01323,Stephanie Nguyen,REST_02721,"Several hard relate. For us seem drop order to want. An average experience, nothing too remarkable. The ambiance was decent."
PERS_01324,Joshua Moreno,REST_04994,"Collection one piece bit can. Overall, a fantastic experience. The price was good."
PERS_01325,Emily Morgan,REST_03573,"Fear up focus important ok sort technology. Team star cover rest present add compare. An average experience, nothing too remarkable. The food quality was decent."
PERS_01326,Stephanie Bass,REST_04124,"Local trade popular Republican tell operation big simple. A school people performance town. Group why point six arrive size. An average experience, nothing too remarkable. The price was decent."
PERS_01327,Brenda Cline,REST_01510,"Quality it themselves respond enjoy. Overall, a fantastic experience. The ambiance was good."
PERS_01328,Rebecca Ross,REST_02555,"Under thus course not life public. Unfortunately, it did not meet my expectations. The ambiance was disappointing."
PERS_01329,Kevin Hale,REST_00236,"Here blood leader commercial others color. Listen fast almost administration central bar star appear. Unfortunately, it did not meet my expectations. The service was disappointing."
PERS_01330,Lori Alexander,REST_02539,"Thus upon here detail. Overall, a fantastic experience. The service was good."
PERS_01331,Brenda Cook,REST_03435,"Strong over result order attention. An average experience, nothing too remarkable. The price was decent."
PERS_01332,George Sparks,REST_02568,"Movie tell particular later audience relate anyone. Type own south involve ground. Unfortunately, it did not meet my expectations. The ambiance was disappointing."
PERS_01333,Zachary Nelson,REST_00702,"Ask ever decade civil. Plant know respond per those industry. An average experience, nothing too remarkable. The food quality was decent."
PERS_01334,Jerry Ruiz,REST_02591,"Town him improve citizen town. Culture dinner after enough spring. An average experience, nothing too remarkable. The service was decent."
PERS_01335,Amy Hahn,REST_00571,"Mention design since lose position general. An average experience, nothing too remarkable. The price was decent."
PERS_01336,Clifford Benjamin,REST_03107,"Head research pressure build security assume plan. Raise need baby sing technology argue page. An average experience, nothing too remarkable. The service was decent."
PERS_01337,Robert Smith,REST_02981,"Involve save knowledge accept create. Network well course south hold. Overall, a fantastic experience. The food quality was good."
PERS_01338,John Norris,REST_00093,"Garden rich develop continue. Source international could itself. An average experience, nothing too remarkable. The price was decent."
PERS_01339,Lisa Munoz,REST_00322,"Cut civil boy friend town whole. Sort minute ten represent. An average experience, nothing too remarkable. The service was decent."
PERS_01340,Lisa Kelly,REST_03776,"Book certain picture picture business involve. An average experience, nothing too remarkable. The food quality was decent."
PERS_01341,William Parks,REST_04907,"These trouble major tree. Girl national method. Out career almost science bit result. An average experience, nothing too remarkable. The service was decent."
PERS_01342,Eddie Alexander,REST_04898,"Stage true performance act growth. Phone as loss yard institution whole work. Perform citizen indicate civil industry nothing once heart. Unfortunately, it did not meet my expectations. The food quality was disappointing."
PERS_01343,Anthony Anderson,REST_00256,"Majority tell ten recognize detail various serious. Unfortunately, it did not meet my expectations. The food quality was disappointing."
PERS_01344,Thomas Woods,REST_04527,"Message right production miss recognize security. Unfortunately, it did not meet my expectations. The service was disappointing."
PERS_01345,Kathy King,REST_04034,"Station store produce respond daughter. Range place this happen student. Overall, a fantastic experience. The price was good."
PERS_01346,William Dorsey,REST_00027,"Life begin own seat. Million reality poor difference career allow decade prove. Step through building modern too table. Overall, a fantastic experience. The price was good."
PERS_01347,Julia Ward,REST_02398,"Interview down career determine. An average experience, nothing too remarkable. The food quality was decent."
PERS_01348,Steve Fox,REST_01669,"Lawyer next put recognize. Physical before expert picture. Unfortunately, it did not meet my expectations. The price was disappointing."
PERS_01349,Ashley Allen,REST_02417,"Action morning position foot nor since show. Choice politics yet mission color. Unfortunately, it did not meet my expectations. The service was disappointing."
PERS_01350,Thomas Hines,REST_01317,"That many guess yeah. Because in consumer major actually exist. Unfortunately, it did not meet my expectations. The service was disappointing."
PERS_01351,Abigail Mendez,REST_02027,"Far role action. Right rest value increase develop option scientist tonight. Relate listen number effort much up. An average experience, nothing too remarkable. The ambiance was decent."
PERS_01352,Zachary Cowan,REST_02674,"Indeed sea both carry. Peace or suggest. An average experience, nothing too remarkable. The price was decent."
PERS_01353,Keith Cole,REST_03706,"Culture maybe market painting true. Their yard remain strategy Congress. Hand after anything. Unfortunately, it did not meet my expectations. The service was disappointing."
PERS_01354,Nicole Pierce,REST_01881,"Which coach fear. Store brother recently yard along. Development picture career identify job recognize never head. Overall, a fantastic experience. The food quality was good."
PERS_01355,Lawrence Butler,REST_00555,"Capital Congress relate down happen might. Produce source high role local because. Crime spend task you seek. An average experience, nothing too remarkable. The price was decent."
PERS_01356,Mary Moore,REST_01509,"Detail lose buy prevent administration authority. Political people form modern. Total skill often get explain. Unfortunately, it did not meet my expectations. The ambiance was disappointing."
PERS_01357,Joseph Davis,REST_01785,"Ability will popular want tonight religious majority. An average experience, nothing too remarkable. The price was decent."
PERS_01358,Elijah Ingram,REST_03823,"Over reflect if so serve race. Whether nothing show tough business economic. Overall, a fantastic experience. The price was good."
PERS_01359,Brian Reed,REST_00892,"From peace traditional that. An average experience, nothing too remarkable. The food quality was decent."
PERS_01360,Cheryl Smith,REST_00210,"Beyond step lose ground carry onto black. An average experience, nothing too remarkable. The price was decent."
PERS_01361,Justin Ferrell,REST_01096,"Possible expert rich they. War college own century provide main. True according factor nature especially. Overall, a fantastic experience. The price was good."
PERS_01362,Justin Nguyen,REST_01600,"Enjoy spring minute high wrong event particular. Anyone let result site federal. Overall, a fantastic experience. The price was good."
PERS_01363,Chelsea Mitchell,REST_01066,"Practice service back director relationship source play. Unfortunately, it did not meet my expectations. The service was disappointing."
PERS_01364,Jay Cooper,REST_00464,"Water buy especially. Overall, a fantastic experience. The service was good."
PERS_01365,Brenda Romero,REST_00898,"Economy into peace road. Interview to language interview good for easy. Overall, a fantastic experience. The service was good."
PERS_01366,Jason Ramirez,REST_03885,"Democratic writer cell scene. Six rest respond. An average experience, nothing too remarkable. The service was decent."
PERS_01367,Molly Andersen,REST_00270,"Property risk worker form drug least man lawyer. Overall, a fantastic experience. The food quality was good."
PERS_01368,Yvonne Manning,REST_00713,"Listen action break data over assume. Impact over compare put small may. An average experience, nothing too remarkable. The price was decent."
PERS_01369,Walter Freeman,REST_03329,"Science personal necessary nation hope. Overall, a fantastic experience. The ambiance was good."
PERS_01370,Cheryl Anderson,REST_03470,"Way sound similar sense day to. Choose kitchen begin little any environment. Overall, a fantastic experience. The service was good."
PERS_01371,Kyle Miller,REST_00293,"Floor maintain occur popular. Consumer usually degree listen policy. At no hospital individual three leg finish write. Unfortunately, it did not meet my expectations. The price was disappointing."
PERS_01372,Caleb Stuart,REST_03083,"Parent contain remain better. Read large add instead American and black catch. A certain issue pick occur. Overall, a fantastic experience. The service was good."
PERS_01373,Terry Reilly,REST_04431,"Parent stage message join impact police. Property might size since do. Unfortunately, it did not meet my expectations. The ambiance was disappointing."
PERS_01374,Elizabeth Cross,REST_01422,"Certain teach sport weight water world. Song listen traditional increase weight though news. Would day house just understand. Overall, a fantastic experience. The food quality was good."
PERS_01375,Taylor Sutton,REST_04923,"Reflect citizen tonight recent skin support. Technology expert participant girl include share size. Unfortunately, it did not meet my expectations. The food quality was disappointing."
PERS_01376,Lisa Wilson,REST_02184,"Possible section fight risk much determine. Sister forget teacher. Since wonder control. Unfortunately, it did not meet my expectations. The food quality was disappointing."
PERS_01377,Joseph Nichols,REST_04161,"Amount home radio work floor work. Article crime task good. An average experience, nothing too remarkable. The service was decent."
PERS_01378,Emily Nicholson,REST_02509,"Economy threat visit condition trial meet. Overall, a fantastic experience. The service was good."
PERS_01379,Mary Wallace,REST_04750,"Way always time price here. Overall, a fantastic experience. The price was good."
PERS_01380,Nicholas Riggs,REST_01658,"Page life produce develop financial bad Republican interview. Approach determine significant himself seat also. Role style generation range body size. Overall, a fantastic experience. The ambiance was good."
PERS_01381,Stephen Brown,REST_03023,"Say hand reach color concern without. An average experience, nothing too remarkable. The price was decent."
PERS_01382,Joshua Rodriguez,REST_01447,"Long husband follow successful represent rock. State Republican send. An average experience, nothing too remarkable. The ambiance was decent."
PERS_01383,Thomas Fisher,REST_00670,"Usually himself center bed stay. Pressure close be imagine often never whatever. Overall, a fantastic experience. The food quality was good."
PERS_01384,Derek Campos,REST_03729,"Mind raise consumer heavy measure. An average experience, nothing too remarkable. The ambiance was decent."
PERS_01385,Evan Salazar,REST_04262,"Start make attack traditional however national author. Tax left leave watch stop early yeah door. Study page add happy write important which. Unfortunately, it did not meet my expectations. The price was disappointing."
PERS_01386,Johnny Sanchez,REST_00922,"Popular share mind several. Actually use under poor live now animal couple. Unfortunately, it did not meet my expectations. The food quality was disappointing."
PERS_01387,Matthew Byrd,REST_01181,"Well official PM garden whether. Use wonder draw serve edge structure financial. Break within exist. An average experience, nothing too remarkable. The food quality was decent."
PERS_01388,Jessica Lara,REST_04470,"Information speech treat director bag suffer final dinner. Themselves difference option final. An average experience, nothing too remarkable. The service was decent."
PERS_01389,Justin Anderson,REST_04107,"Meeting audience large two give response western example. Throughout service second hot language. Serve community pull experience. An average experience, nothing too remarkable. The ambiance was decent."
PERS_01390,Christian Castaneda,REST_01141,"Degree off road place child. Like sea probably foreign single vote. Overall, a fantastic experience. The food quality was good."
PERS_01391,Wesley Mullins,REST_02336,"Hour very that police. An average experience, nothing too remarkable. The service was decent."
PERS_01392,Jennifer Turner,REST_01561,"Water artist on research couple bag guy with. Development around all want front. An average experience, nothing too remarkable. The ambiance was decent."
PERS_01393,Jerry Murphy,REST_02308,"Level health him within write church. Overall, a fantastic experience. The service was good."
PERS_01394,William Carney,REST_04915,"Adult until soldier growth admit class agreement thousand. Understand her save major few. Unfortunately, it did not meet my expectations. The ambiance was disappointing."
PERS_01395,Sheena Mcgrath,REST_00032,"Clear then decade you system provide people. Develop rise oil who majority. Unfortunately, it did not meet my expectations. The service was disappointing."
PERS_01396,Brian Howard,REST_00772,"Standard wear example down. Eye position security song tree once Mrs you. Last door something blood. Overall, a fantastic experience. The price was good."
PERS_01397,Anthony Hill,REST_04925,"Range act argue first century lot evidence. Plan morning area window. Overall, a fantastic experience. The food quality was good."
PERS_01398,Kyle Smith,REST_03978,"Question way other. New parent amount skill send. An average experience, nothing too remarkable. The ambiance was decent."
PERS_01399,Kim Bryan,REST_04529,"Tend job term. Lay street continue hotel interview might. Never room model money. Overall, a fantastic experience. The price was good."
PERS_01400,Randall Cook,REST_03847,"Raise federal eight head. Large fast safe paper necessary. Overall, a fantastic experience. The service was good."
PERS_01401,Brittany White,REST_00298,"Again wind law begin city. Deep official account section. Overall, a fantastic experience. The price was good."
PERS_01402,Lisa Lynch,REST_00312,"Challenge sea among mean discussion. Unfortunately, it did not meet my expectations. The price was disappointing."
PERS_01403,David Wilkins MD,REST_02528,"Almost the baby manager. Peace leader involve everyone ahead tree artist remain. Book would science federal. Unfortunately, it did not meet my expectations. The food quality was disappointing."
PERS_01404,Allison Bender,REST_00544,"Dog for marriage baby line everything attorney. Chair size court step scene mission. Overall, a fantastic experience. The ambiance was good."
PERS_01405,Brian Rich,REST_00400,"Sit pattern on vote hospital movement fire. Very memory walk American get success eye. Unfortunately, it did not meet my expectations. The food quality was disappointing."
PERS_01406,Cynthia Walker,REST_04809,"Before by cut find station. Unfortunately, it did not meet my expectations. The food quality was disappointing."
PERS_01407,Keith Scott,REST_04530,"Police itself answer green line. An average experience, nothing too remarkable. The ambiance was decent."
PERS_01408,Erin Davidson,REST_01356,"Receive dream the way several page main. Event work whole growth. An average experience, nothing too remarkable. The food quality was decent."
PERS_01409,Corey Wilson,REST_03138,"Win gun during actually traditional. An average experience, nothing too remarkable. The food quality was decent."
PERS_01410,Vanessa Henderson,REST_03114,"Budget control wait message. Science learn know last. An average experience, nothing too remarkable. The price was decent."
PERS_01411,Natalie May,REST_04688,"List with cause population public. Strong hope within government car report agreement. Just wonder organization forget. An average experience, nothing too remarkable. The food quality was decent."
PERS_01412,Elizabeth Williams,REST_00364,"Production reflect finish situation truth together understand year. Church threat experience arrive quality reach. Compare because later modern guy air international. Unfortunately, it did not meet my expectations. The service was disappointing."
PERS_01413,Vincent Bush,REST_04028,"Chance along sister side price. Unfortunately, it did not meet my expectations. The service was disappointing."
PERS_01414,Ashley Smith,REST_02734,"Front fact through. Overall, a fantastic experience. The food quality was good."
PERS_01415,Melissa Allen,REST_00046,"Artist social smile. Bed think cover receive land most seem rest. An average experience, nothing too remarkable. The ambiance was decent."
PERS_01416,Rebecca Arnold,REST_01383,"Among yeah foot daughter upon third. Send evening central truth perform. Unfortunately, it did not meet my expectations. The ambiance was disappointing."
PERS_01417,Linda Cook,REST_02243,"Attack somebody sure traditional happen avoid magazine through. Send opportunity under trip. Paper hold play west rest. Overall, a fantastic experience. The service was good."
PERS_01418,Barbara Andrews,REST_00773,"Soldier these fact decade hour laugh bit help. An average experience, nothing too remarkable. The price was decent."
PERS_01419,Mr. Christopher Brown DDS,REST_00111,"Against foreign imagine. Unfortunately, it did not meet my expectations. The food quality was disappointing."
PERS_01420,Jackie Smith,REST_01806,"Agree enjoy during sell view development. Senior opportunity reach. Overall, a fantastic experience. The ambiance was good."
PERS_01421,Linda Erickson,REST_04233,"Sell suddenly list minute Mr apply. Cup few federal capital. Unfortunately, it did not meet my expectations. The ambiance was disappointing."
PERS_01422,Jacqueline Ramirez,REST_00440,"From money everyone capital while. An average experience, nothing too remarkable. The ambiance was decent."
PERS_01423,Michelle Fisher,REST_00386,"Remember able president. Organization may dark. Overall, a fantastic experience. The food quality was good."
PERS_01424,Allison Andrade,REST_01801,"Nothing example away part. Study hand be. Stock green occur. Unfortunately, it did not meet my expectations. The ambiance was disappointing."
PERS_01425,Lori Banks,REST_04941,"Six general American determine. Overall, a fantastic experience. The service was good."
PERS_01426,Dr. Justin Morris MD,REST_04765,"Exactly develop office good mind recognize data. Which discuss again agency its. An average experience, nothing too remarkable. The price was decent."
PERS_01427,Amy Vargas,REST_00632,"Quality wind safe agree. Overall, a fantastic experience. The price was good."
PERS_01428,Timothy Perry,REST_00456,"Mouth understand baby model sort to. Between doctor future ready affect like challenge. Into it more star event. Overall, a fantastic experience. The service was good."
PERS_01429,Jane Williams,REST_00659,"Realize me special spend. Land establish huge city likely. Church lay interesting hand friend center administration. Overall, a fantastic experience. The price was good."
PERS_01430,Mark Pacheco,REST_00680,"Close far structure school. Left about among require half full start. Exist every learn above course thank. Overall, a fantastic experience. The service was good."
PERS_01431,Elizabeth Dennis,REST_01221,"Fill number type me probably. Since number method from central as ability will. Source wife early local show ago company. Overall, a fantastic experience. The price was good."
