PersonID,PersonName,LikesRestaurantID,Review
PERS_00001,Rebecca Brooks,REST_01350,"Marriage past city responsibility offer successful bank. Go really while behind international often. An average experience, nothing too remarkable. The price was decent."
PERS_00002,Jessica Johnson,REST_02943,"Day himself growth service determine hard. Suggest color spend. Set color girl total pretty. An average experience, nothing too remarkable. The food quality was decent."
PERS_00003,Sarah Adams,REST_03916,"Company size wife yeah. Unfortunately, it did not meet my expectations. The price was disappointing."
PERS_00004,Elizabeth Torres,REST_03088,"Onto research build perhaps himself. Unfortunately, it did not meet my expectations. The ambiance was disappointing."
PERS_00005,Mark Ramos,REST_02033,"Mind tonight develop represent. Overall, a fantastic experience. The ambiance was good."
PERS_00006,Joseph Diaz,REST_03155,"Various food main. Thus himself throughout provide institution capital argue. Toward people exist stage red technology. Unfortunately, it did not meet my expectations. The ambiance was disappointing."
PERS_00007,Anthony Swanson,REST_04431,"Center sign might especially buy. Visit environment act guess discuss. Employee might position start future hundred. An average experience, nothing too remarkable. The food quality was decent."
PERS_00008,Kirk Martinez,REST_02303,"When science list spend buy traditional alone. Hair skin factor reveal education particular. An average experience, nothing too remarkable. The service was decent."
PERS_00009,Timothy Petersen,REST_01479,"Relate wife remember test. Decide sister attorney authority. Overall, a fantastic experience. The ambiance was good."
PERS_00010,Gerald Glass,REST_02930,"Stock first arrive go positive bag. Most argue talk their little focus professional. Never from price choose. Overall, a fantastic experience. The ambiance was good."
PERS_00011,Kevin Fisher,REST_00608,"Weight them else scene subject I. Overall, a fantastic experience. The ambiance was good."
PERS_00012,Isaiah Brown,REST_04175,"Husband pass production lead study wonder south body. History traditional shake month player. Perhaps nice development west time no follow. An average experience, nothing too remarkable. The ambiance was decent."
PERS_00013,Daniel Roth,REST_03908,"Authority itself whose catch step year life. Speech together reflect contain. An average experience, nothing too remarkable. The food quality was decent."
PERS_00014,Morgan Parks,REST_02601,"Wear everything player recent Mrs. Think produce nor budget green subject central particular. Unfortunately, it did not meet my expectations. The ambiance was disappointing."
PERS_00015,Sharon Foster,REST_04348,"These daughter serve language public. Unfortunately, it did not meet my expectations. The price was disappointing."
PERS_00016,Anne Strickland,REST_03014,"List area break phone degree question response. Unfortunately, it did not meet my expectations. The price was disappointing."
PERS_00017,Diana Taylor,REST_01936,"Boy idea seem knowledge movie. Painting family second product with result bar. Behind seem their if while. Unfortunately, it did not meet my expectations. The food quality was disappointing."
PERS_00018,Daniel Garza,REST_01515,"However those animal anything find. Pick check black. Unfortunately, it did not meet my expectations. The food quality was disappointing."
PERS_00019,Rachel Aguilar,REST_00168,"Gun imagine including matter. Major likely simple trial market then medical. Of character score third heart dog audience themselves. Unfortunately, it did not meet my expectations. The price was disappointing."
PERS_00020,Michelle Stephens,REST_00292,"Sea although reach information item participant training. Skin development analysis hard claim region. Rich young price speak deal idea. Unfortunately, it did not meet my expectations. The food quality was disappointing."
PERS_00021,Jeffery Stewart,REST_04354,"Fund history information determine check coach economic. Side station defense girl then thus. Movement society prove trouble create value true. Unfortunately, it did not meet my expectations. The service was disappointing."
PERS_00022,Cassandra Kennedy,REST_01664,"Step on not effect sell per anything. Scientist model just. An average experience, nothing too remarkable. The service was decent."
PERS_00023,Kayla Summers,REST_01467,"Save him suffer in. Overall, a fantastic experience. The price was good."
PERS_00024,Samantha Jennings,REST_00449,"Speech research million member audience nor better. An average experience, nothing too remarkable. The ambiance was decent."
PERS_00025,Stacy Smith,REST_02905,"Physical half federal message couple lose. Fish tough prepare six smile. An average experience, nothing too remarkable. The food quality was decent."
PERS_00026,Pam James,REST_01601,"Interview treatment against standard eye. Half sense south understand me clearly. Believe summer very bar idea have chair. Overall, a fantastic experience. The food quality was good."
PERS_00027,Jason Smith,REST_04697,"Expert we admit full which. Debate never floor meeting green box add. Identify play evidence among protect free meet. An average experience, nothing too remarkable. The service was decent."
PERS_00028,Christine Hill MD,REST_02461,"Various agency poor number arrive. Lay article subject meet simply whom and. An average experience, nothing too remarkable. The ambiance was decent."
PERS_00029,Edward Peterson,REST_01514,"Factor himself prepare get character. An average experience, nothing too remarkable. The service was decent."
PERS_00030,Steven Hughes,REST_01212,"Discuss mother easy build seat. Me send magazine analysis provide. However base product guess. An average experience, nothing too remarkable. The price was decent."
PERS_00031,Ashley Lawrence,REST_01993,"Public just bank be trip take huge weight. Mouth manage about more join. Unfortunately, it did not meet my expectations. The ambiance was disappointing."
PERS_00032,James Jacobson,REST_03348,"Choice beat major benefit. Hotel model set run walk. Unfortunately, it did not meet my expectations. The food quality was disappointing."
PERS_00033,Jeff Davidson,REST_01756,"Officer call network new two everything. Step computer defense picture everything nothing majority. Unfortunately, it did not meet my expectations. The service was disappointing."
PERS_00034,Edward James,REST_02108,"Bring a thank white over challenge. Fish while can responsibility. Overall, a fantastic experience. The food quality was good."
PERS_00035,Jessica Mitchell,REST_02121,"Vote move though common network audience. Newspaper someone benefit information. Trade five study. Overall, a fantastic experience. The ambiance was good."
PERS_00036,Steve Byrd,REST_03124,"Knowledge development gas affect nor. An average experience, nothing too remarkable. The food quality was decent."
PERS_00037,Andrea Douglas,REST_00809,"Bed moment hold stop. Guy story and front technology else main message. I table get blood. An average experience, nothing too remarkable. The food quality was decent."
PERS_00038,Lynn Barrett,REST_03792,"Treat model democratic out game manager garden throw. Sure national campaign pattern argue least member. An average experience, nothing too remarkable. The service was decent."
PERS_00039,Regina Jones,REST_00234,"Fill into among inside east keep. An average experience, nothing too remarkable. The ambiance was decent."
PERS_00040,Andrea Baker,REST_04906,"Education while sport traditional group address fall stay. Thing happen meet light deal imagine friend. An average experience, nothing too remarkable. The price was decent."
PERS_00041,Jeffrey Wilson,REST_04188,"Travel talk let front skill. Green wall along shake day enough sure. Simple son treat management entire ask. Overall, a fantastic experience. The ambiance was good."
PERS_00042,Raymond Curry,REST_00134,"Six can season hear. Overall, a fantastic experience. The service was good."
PERS_00043,Stephen Douglas,REST_03691,"Structure again could expect daughter phone ready peace. Heavy crime item agency. Then guess policy relate main though certain. An average experience, nothing too remarkable. The ambiance was decent."
PERS_00044,Jamie Moore,REST_04714,"One whose either medical fly power information. Along then station. Far apply this. Unfortunately, it did not meet my expectations. The food quality was disappointing."
PERS_00045,Anna Martin,REST_03846,"Organization long everyone long image receive cold personal. Catch feel discussion strategy structure. An average experience, nothing too remarkable. The ambiance was decent."
PERS_00046,Dustin Payne,REST_00662,"Factor prove until stand just again box budget. An average experience, nothing too remarkable. The ambiance was decent."
PERS_00047,Valerie Clark,REST_00768,"Form step idea spring address example. Unfortunately, it did not meet my expectations. The price was disappointing."
PERS_00048,John Rodriguez,REST_01108,"Officer newspaper local activity since standard quite. Overall, a fantastic experience. The price was good."
PERS_00049,Brent Payne,REST_00917,"Board southern feeling piece. Unfortunately, it did not meet my expectations. The ambiance was disappointing."
PERS_00050,Nicholas Yoder,REST_01229,"Activity federal peace. Wrong rise really security memory morning soldier. Join may seek long government. Unfortunately, it did not meet my expectations. The food quality was disappointing."
PERS_00051,Andrew Hill,REST_01588,"Either if nature treatment allow to. Unfortunately, it did not meet my expectations. The price was disappointing."
PERS_00052,David Gonzales,REST_04932,"Pattern federal recognize student ago ok. Page usually between use win shoulder research money. Region last such take station school. Unfortunately, it did not meet my expectations. The price was disappointing."
PERS_00053,Julia Davis,REST_02767,"Perform draw machine. Modern inside smile drop very. An average experience, nothing too remarkable. The price was decent."
PERS_00054,Lisa Bradley,REST_00420,"Hit new shoulder any country. Concern doctor raise hundred. And direction herself. Unfortunately, it did not meet my expectations. The service was disappointing."
PERS_00055,Jessica Suarez MD,REST_03167,"Stage sing different your well chance position. Then painting heart however officer. Stop particular institution help threat capital yes. An average experience, nothing too remarkable. The price was decent."
PERS_00056,Jared Johns,REST_00812,"Project foreign performance option other professor. Summer science color idea someone western. Unfortunately, it did not meet my expectations. The service was disappointing."
PERS_00057,Devin Powell,REST_04212,"Agree watch between camera marriage read. National cause usually garden several write sing. Least language beat job quickly. An average experience, nothing too remarkable. The ambiance was decent."
PERS_00058,Joseph Manning,REST_02430,"Character top for factor religious least simple. An average experience, nothing too remarkable. The food quality was decent."
PERS_00059,Curtis Ibarra,REST_00259,"Never without yet feel nor will clearly certain. Chair child gun reason. Look avoid their candidate. Unfortunately, it did not meet my expectations. The price was disappointing."
PERS_00060,Bryan Baker,REST_00495,"Financial be great bit. Overall, a fantastic experience. The service was good."
PERS_00061,Jeffery Webb,REST_03298,"Anyone class care whose degree recognize exactly. Own ground listen establish win despite. Course unit case item mouth sense baby. Unfortunately, it did not meet my expectations. The price was disappointing."
PERS_00062,Cassandra Lowery,REST_02608,"Everything threat lead capital eat rate his. Hour project shoulder but. Unfortunately, it did not meet my expectations. The service was disappointing."
PERS_00063,Caitlin Moreno,REST_04389,"Be use whatever smile those above. Building central chair answer. An average experience, nothing too remarkable. The ambiance was decent."
PERS_00064,Derek Johnson,REST_02509,"Give officer goal market. Unfortunately, it did not meet my expectations. The service was disappointing."
PERS_00065,Zachary Fuller,REST_01994,"Above event question size. Seek capital room specific like modern. Per leave mind listen member. An average experience, nothing too remarkable. The price was decent."
PERS_00066,David Sellers,REST_01618,"Little ago song just both provide. Overall, a fantastic experience. The food quality was good."
PERS_00067,Tristan Watson,REST_01008,"Expect film set medical back move attack fill. Property even difficult one pretty many operation. Network within unit teacher. Overall, a fantastic experience. The price was good."
PERS_00068,Megan George,REST_02537,"Court per series feeling edge. Unfortunately, it did not meet my expectations. The food quality was disappointing."
PERS_00069,Heather Ramirez,REST_00372,"Force cut wish hot. Care evidence wife late accept example. Too remain performance ahead help ten. Overall, a fantastic experience. The service was good."
PERS_00070,Robin Galvan,REST_03119,"Word tend responsibility tax under. Put field gun tree along quite heavy. An average experience, nothing too remarkable. The service was decent."
PERS_00071,Monique Richards,REST_03632,"Drop site human include ok no. Soon increase feeling now fight administration item. Forget soldier wind his fund million. An average experience, nothing too remarkable. The ambiance was decent."
PERS_00072,Traci Garcia,REST_02229,"Difference way professional worker. Overall, a fantastic experience. The price was good."
PERS_00073,Lauren Butler,REST_03840,"Model party answer because travel same. Overall, a fantastic experience. The ambiance was good."
PERS_00074,Jessica Brewer,REST_01027,"Against main part treatment full artist. Else part hair expect program science wide. These somebody listen her real Mr. Unfortunately, it did not meet my expectations. The food quality was disappointing."
PERS_00075,Jeffrey Callahan,REST_02156,"Fine follow age what hundred. Unfortunately, it did not meet my expectations. The service was disappointing."
PERS_00076,Sarah Kennedy,REST_03323,"Strategy our true media whole market fly education. Overall, a fantastic experience. The ambiance was good."
PERS_00077,Derrick Koch,REST_01993,"Alone although plan top off. Difficult subject follow moment. An average experience, nothing too remarkable. The service was decent."
PERS_00078,Victor Lee,REST_00973,"Something office small success that who human speech. An average experience, nothing too remarkable. The ambiance was decent."
PERS_00079,Suzanne Torres,REST_03783,"Amount meet only mind consider. Unfortunately, it did not meet my expectations. The price was disappointing."
PERS_00080,Derrick Cole,REST_01933,"Political time material series ball religious. Overall, a fantastic experience. The ambiance was good."
PERS_00081,Michael Smith,REST_00628,"Laugh administration word American however wrong enjoy. Another agent ability strong. Overall, a fantastic experience. The service was good."
PERS_00082,Andrew Williams,REST_04605,"Anything century such stage full wind say. An average experience, nothing too remarkable. The ambiance was decent."
PERS_00083,Shelby Martinez,REST_03591,"Environmental such purpose foot effort anyone season unit. Difference oil bed important region. Subject newspaper trouble fall case huge staff ago. An average experience, nothing too remarkable. The price was decent."
PERS_00084,Stephen Taylor,REST_02589,"Product board season line. Manager read together personal culture. Air the they determine nothing give instead. Unfortunately, it did not meet my expectations. The service was disappointing."
PERS_00085,Ryan Spencer,REST_02743,"Air pass stay director concern. Song hard instead value. Senior million let inside too and. An average experience, nothing too remarkable. The service was decent."
PERS_00086,Kristin Reynolds,REST_04292,"Popular letter bit international education conference. Mouth make doctor standard kid politics. Early hot what central someone. Overall, a fantastic experience. The ambiance was good."
PERS_00087,Heather Russell,REST_04100,"Moment everything spend kitchen door wide. Audience real price despite decade their. Overall, a fantastic experience. The service was good."
PERS_00088,Christina Phillips,REST_03120,"Notice before player later stage cup strategy. Push pull race law chance already. Term human necessary sign carry floor race see. An average experience, nothing too remarkable. The food quality was decent."
PERS_00089,Patrick Lewis,REST_01763,"Whether play fish order professor whole sometimes. Unfortunately, it did not meet my expectations. The food quality was disappointing."
PERS_00090,Willie Evans,REST_02907,"Least campaign trip beautiful service. Defense industry short different name. Overall, a fantastic experience. The price was good."
PERS_00091,Mrs. Sherry Miller MD,REST_03425,"Heart agent I. Information mean foreign page. An average experience, nothing too remarkable. The ambiance was decent."
PERS_00092,Chad Herrera,REST_03173,"Play meet citizen minute bill crime computer. May air style be attorney need. Bring seat especially meet huge newspaper. Unfortunately, it did not meet my expectations. The ambiance was disappointing."
PERS_00093,Amy Wade,REST_00530,"Up look example federal have citizen water. Nothing reduce trade professional room agreement board. An average experience, nothing too remarkable. The ambiance was decent."
PERS_00094,Tina Francis,REST_03458,"Glass commercial international mouth career movie property. Class organization thank animal must. Overall, a fantastic experience. The price was good."
PERS_00095,Jordan Walters,REST_01541,"Gun star read. Whatever loss change no compare realize suggest meeting. Unfortunately, it did not meet my expectations. The ambiance was disappointing."
PERS_00096,Brittney Huff,REST_00413,"Research national region future reach. Stuff exactly finally popular late month. Overall, a fantastic experience. The service was good."
PERS_00097,Tiffany Adams,REST_04450,"See rich all in go. Red house capital start. An average experience, nothing too remarkable. The ambiance was decent."
PERS_00098,Barry Henry,REST_02927,"This probably pressure have star. Unfortunately, it did not meet my expectations. The food quality was disappointing."
PERS_00099,Jack Holmes,REST_01555,"Country outside culture enter quality unit. Overall, a fantastic experience. The ambiance was good."
PERS_00100,Priscilla Cox,REST_02033,"Personal subject indicate above. An average experience, nothing too remarkable. The service was decent."
PERS_00101,David Carter,REST_02269,"Star life probably leg. Bed school control pretty. Overall, a fantastic experience. The price was good."
PERS_00102,Diana Fox,REST_01717,"Until race successful stage. Unfortunately, it did not meet my expectations. The price was disappointing."
PERS_00103,Danielle Jones,REST_04105,"Program side bed side age teach personal history. An average experience, nothing too remarkable. The price was decent."
PERS_00104,Deborah Hill,REST_01955,"Easy politics modern maintain factor southern thousand. Network save realize action effect play loss brother. Unfortunately, it did not meet my expectations. The food quality was disappointing."
PERS_00105,Nicholas Green,REST_00807,"Cost skill could final box few after mind. Let eight surface attention. Behavior risk agency region mean follow senior officer. An average experience, nothing too remarkable. The ambiance was decent."
PERS_00106,Jonathan Bautista,REST_03133,"Girl cut determine another yeah light. Field market Democrat address society figure. Stock within wall read this however need country. Unfortunately, it did not meet my expectations. The service was disappointing."
PERS_00107,Colleen Pineda,REST_00306,"Course pick fish dinner cost remain his try. Overall, a fantastic experience. The food quality was good."
PERS_00108,Brittney Young,REST_03476,"While rich but. Several draw data detail other idea. Us learn little ten cold eight what. Unfortunately, it did not meet my expectations. The ambiance was disappointing."
PERS_00109,Dustin Quinn,REST_04556,"Very total individual. Unfortunately, it did not meet my expectations. The ambiance was disappointing."
PERS_00110,Tamara Smith,REST_02199,"Watch across message race. An average experience, nothing too remarkable. The service was decent."
PERS_00111,Julie Paul,REST_00532,"Next vote government. Window small everyone report own itself. An average experience, nothing too remarkable. The service was decent."
PERS_00112,Tony Hughes,REST_03232,"Into campaign by down worker. Prepare also find mouth perform peace woman politics. Unfortunately, it did not meet my expectations. The price was disappointing."
PERS_00113,Mark Campos,REST_02158,"Add worry why arm adult pretty degree great. Discuss me reason film. An average experience, nothing too remarkable. The ambiance was decent."
PERS_00114,Nicole Moore,REST_03276,"Down design star front business partner. An average experience, nothing too remarkable. The ambiance was decent."
PERS_00115,Troy Oconnor,REST_00410,"Word take any happen perform avoid pass. Company follow finally until agent. Overall, a fantastic experience. The service was good."
PERS_00116,Jorge Simpson,REST_02752,"Guess their here affect. Gas in whatever worker. Politics guy entire. Unfortunately, it did not meet my expectations. The food quality was disappointing."
PERS_00117,Haley Oneill,REST_00969,"Pm wear civil gas. An average experience, nothing too remarkable. The service was decent."
PERS_00118,Kimberly Clarke DDS,REST_00222,"Down sense pretty help behavior record. Overall, a fantastic experience. The food quality was good."
PERS_00119,Michelle Johnson,REST_00108,"Skin total others executive as. An average experience, nothing too remarkable. The food quality was decent."
PERS_00120,Amanda Reese,REST_03955,"Son fly save sign you performance group. Speech act time into possible. Overall, a fantastic experience. The food quality was good."
PERS_00121,Jason White,REST_03996,"Free city indeed group father company carry like. An average experience, nothing too remarkable. The ambiance was decent."
PERS_00122,Jennifer Bishop,REST_03754,"Safe help ask all really. Short hope occur language while town wonder. Blood camera coach general. Overall, a fantastic experience. The food quality was good."
PERS_00123,Mike Long,REST_02779,"Kind general different boy. Them respond just loss eye car. Overall, a fantastic experience. The price was good."
PERS_00124,Sarah Daniel,REST_00877,"Mr bit ask shake step. Over weight morning myself choose avoid. An average experience, nothing too remarkable. The ambiance was decent."
PERS_00125,Nicholas Patterson,REST_03143,"Economy war hot mention issue. Unfortunately, it did not meet my expectations. The ambiance was disappointing."
PERS_00126,John Richards,REST_02249,"Glass situation decade crime trouble again. Human four race us score. Mind become commercial avoid even them. An average experience, nothing too remarkable. The price was decent."
PERS_00127,Sue Johnson,REST_02383,"Deep unit ago official arm. Special mother physical at direction use. Overall, a fantastic experience. The price was good."
PERS_00128,Shannon Chandler,REST_02326,"Economy base church system give name alone cell. Hundred eight eight authority rich. Overall, a fantastic experience. The ambiance was good."
PERS_00129,David Lopez,REST_04075,"Fast choice exactly include late. Decide step whose have our air police. Term hour manager night month sell seven through. Unfortunately, it did not meet my expectations. The food quality was disappointing."
PERS_00130,Jeremy Ayala,REST_00131,"Yeah relate standard act tell accept lawyer light. An average experience, nothing too remarkable. The service was decent."
PERS_00131,Patricia Estrada,REST_01629,"May through series. Reality tax resource ok affect. Democrat rate almost everything join. Unfortunately, it did not meet my expectations. The price was disappointing."
PERS_00132,Scott Sloan,REST_01707,"President argue represent true development soon enjoy. An average experience, nothing too remarkable. The price was decent."
PERS_00133,Daniel Harrison,REST_00529,"Start save animal. Action easy claim while very. Unfortunately, it did not meet my expectations. The price was disappointing."
PERS_00134,Heidi Cox,REST_02238,"Alone should south street Congress teach on. Material tell teacher response boy own modern. Education among the break tell sometimes. Overall, a fantastic experience. The ambiance was good."
PERS_00135,Timothy Jackson,REST_03857,"Any story growth environment. Receive other check first because bag agreement bill. An average experience, nothing too remarkable. The ambiance was decent."
PERS_00136,Albert Gross,REST_02397,"Assume several certainly seat. Investment continue design police. Overall, a fantastic experience. The food quality was good."
PERS_00137,Corey Moore,REST_01413,"Sport it become ask. Couple provide wear shoulder try billion. Overall, a fantastic experience. The service was good."
PERS_00138,Ellen Blackwell,REST_01439,"International respond often. Become small course heart worker window school. Unfortunately, it did not meet my expectations. The service was disappointing."
PERS_00139,Jessica Bullock,REST_02270,"Prove through trouble spring but tax. An average experience, nothing too remarkable. The food quality was decent."
PERS_00140,Haley Brooks,REST_02118,"Condition might reveal north eye century long. Unfortunately, it did not meet my expectations. The ambiance was disappointing."
PERS_00141,Cindy Snyder,REST_00782,"Play can stuff book reach fire. Overall, a fantastic experience. The service was good."
PERS_00142,Dana Price,REST_01722,"Music data be book window girl. Cost could image those. An average experience, nothing too remarkable. The ambiance was decent."
